Duration,Start,Automated,Manual
3.9,813.85,backgrounds and I really just like being,backgrounds and I really just like being
4.2,816.1,part of this kind of like diverse,part of this kind of like diverse
6.42,817.75,community here so that would be my,community here so that would be my
5.729,820.3,favorite part so I believe that you,favorite part so I believe that you
3.51,824.17,found this conversation really helpful,found this conversation really helpful
3.451,826.029,if you are new immigrants in the United,if you are new immigrants in the United
3.81,827.68,States especially you are if you are in,States especially you are if you are in
5.16,829.48,New York City definitely reach out to,New York City definitely reach out to
7.28,831.49,ESU onic and on that note it's time to,ESU onic and on that note it's time to
5.61,834.64,say bye-bye so you take care bye guys,say bye-bye so you take care bye guys
3.4,838.77,hey guys,hey guys
4.89,840.25,a quick note if you have a personal,a quick note if you have a personal
4.89,842.17,story that you think might be helpful to,story that you think might be helpful to
4.17,845.14,the newly arriving immigrants in the US,the newly arriving immigrants in the US
4.08,847.06,please contact us we would love to,please contact us we would love to
4.23,849.31,feature you in our podcast go to our,feature you in our podcast go to our
5.37,851.14,website podcast at the end of the day,website podcast at the end of the day
5.489,853.54,comm and write to us by going to the,comm and write to us by going to the
4.53,856.51,feedback section and by the way if you,feedback section and by the way if you
4.56,859.029,love this podcast you can support us,love this podcast you can support us
5.34,861.04,with a small donation your help will,with a small donation your help will
5.401,863.589,enable us to continue producing more,enable us to continue producing more
6.5,866.38,episodes the link to support our podcast,episodes the link to support our podcast
3.89,868.99,is in the description below,is in the description below
