Duration,Start,Automated,Manual
6.09,893.1,that I woke up at 6 a.m. in the morning,that I woke up at 6 a.m. in the morning
5.46,895.98,I went to the gym training for like two,I went to the gym training for like two
4.17,899.19,hours then took a shower and a night,hours then took a shower and a night
4.47,901.44,time and there was like something that I,time and there was like something that I
6.69,903.36,really appreciate of him he took the,really appreciate of him he took the
6.239,905.91,time to like read and also like make,time to like read and also like make
5.07,910.05,like circles that is fine no it's better,like circles that is fine no it's better
4.981,912.149,if you say that like big it wasn't with,if you say that like big it wasn't with
6.87,915.12,me the good exercise for like a month,me the good exercise for like a month
6.99,917.13,obviously like now so now we have come,obviously like now so now we have come
4.92,921.99,to the end of the podcast Sandra if,to the end of the podcast Sandra if
4.14,924.12,there is something you wanted to do,there is something you wanted to do
3.6,926.91,different while you,different while you
5.61,928.26,I came to America what would that be I,I came to America what would that be I
4.35,930.51,will start like learning English before,will start like learning English before
3.81,933.87,before,before
5.1,934.86,yes to be coming yeah I didn't even look,yes to be coming yeah I didn't even look
5.52,937.68,very young and that's why I say like if,very young and that's why I say like if
6.3,939.96,I will start a family here I'm pretty,I will start a family here I'm pretty
6.15,943.2,sure I will encourage to learn as many,sure I will encourage to learn as many
5.4,946.26,things as they because humans we can,things as they because humans we can
5.31,949.35,learn like everything it's not about age,learn like everything it's not about age
6.53,951.66,is know about but even if it's earlier,is know about but even if it's earlier
6.45,954.66,in your life it will be better yes yes,in your life it will be better yes yes
4.69,958.19,and there might be so many of our,and there might be so many of our
3.75,961.11,audience who might reach out to you bro,audience who might reach out to you bro
8.34,962.88,anybody advice what would be a best way,anybody advice what would be a best way
21.96,964.86,to get in touch with you as a n X X yes,to get in touch with you as a n X X yes
16.86,971.22,i h IH e e r a c e at gmail.com okay you,i h IH e e r a c e at gmail.com okay you
2.82,986.82,mention at the end of the day in the,mention at the end of the day in the
3.24,988.08,subtitles so that Santa knows where,subtitles so that Santa knows where
3.3,989.64,these emails are coming from I like the,these emails are coming from I like the
4.02,991.32,way that you said no matter where you,way that you said no matter where you
2.73,992.94,are on the earth two plus two equals,are on the earth two plus two equals
3.33,995.34,four,four
4.59,995.67,yeah and on that note it's time to say,yeah and on that note it's time to say
3.21,998.67,bye-bye but before we'd say bye-bye,bye-bye but before we'd say bye-bye
4.05,1000.26,we would like to thank in this,we would like to thank in this
4.14,1001.88,english-speaking Union our Nick for,english-speaking Union our Nick for
4.26,1004.31,providing us this wonderful space to,providing us this wonderful space to
4.95,1006.02,record this podcast and our neck an,record this podcast and our neck an
4.26,1008.57,english-speaking Union provides free,english-speaking Union provides free
4.17,1010.97,English classes and free professional,English classes and free professional
3.99,1012.83,development skills to the newly arriving,development skills to the newly arriving
3.72,1015.14,immigrants and yeah thank you for,immigrants and yeah thank you for
3.69,1016.82,watching and listen to our porters and,watching and listen to our porters and
4.17,1018.86,make sure you subscribe to our YouTube,make sure you subscribe to our YouTube
5.55,1020.51,channel is 45 items wherever you find us,channel is 45 items wherever you find us
5.1,1023.03,and to log in to our website podcast and,and to log in to our website podcast and
4.05,1026.06,the end of the dot-com to once addition,the end of the dot-com to once addition
6.51,1028.13,to previous episode yes on that note,to previous episode yes on that note
6.66,1030.11,it's time to say bye bye bye hey guys a,it's time to say bye bye bye hey guys a
4.98,1034.64,quick note if you have a personal story,quick note if you have a personal story
4.65,1036.77,that you think might be helpful to the,that you think might be helpful to the
4.05,1039.62,newly arriving immigrants in the u.s.,newly arriving immigrants in the u.s.
4.08,1041.42,please contact us we would love to,please contact us we would love to
4.23,1043.67,feature you in our podcast go to our,feature you in our podcast go to our
5.37,1045.5,website podcast at the end of the day,website podcast at the end of the day
5.49,1047.9,calm and write to us by going to the,calm and write to us by going to the
4.5,1050.87,feedback section and by the way if you,feedback section and by the way if you
4.38,1053.39,love this podcast you can support us,love this podcast you can support us
4.68,1055.37,with a small donation your help,with a small donation your help
5.04,1057.77,will enable us to continue producing,will enable us to continue producing
7.19,1060.05,more episodes the link to support our,more episodes the link to support our
4.43,1062.81,podcast is in the description below,podcast is in the description below
