Duration,Start,Automated,Manual
3.96,786.98,who have small children get asked that,who have small children get asked that
3.75,789.199,question yeah all right,question yeah all right
3.48,790.94,what kind of course am I asking right no,what kind of course am I asking right no
3.781,792.949,no that's true people ask that all the,no that's true people ask that all the
4.05,794.42,time yeah but you would only ask that,time yeah but you would only ask that
5.7,796.73,question to a mom right normally you,question to a mom right normally you
6.45,798.47,don't ask that question to it but I'm,don't ask that question to it but I'm
4.92,802.43,gonna answer it cuz okay being nice okay,gonna answer it cuz okay being nice okay
5.13,804.92,then the answer is because there's a,then the answer is because there's a
5.669,807.35,very involved dad in the picture and,very involved dad in the picture and
4.289,810.05,that makes that possible in our family,that makes that possible in our family
3.271,813.019,and I think everybody has a different,and I think everybody has a different
5.581,814.339,answer and a different way of making it,answer and a different way of making it
6.39,816.29,work but yeah lots of different things,work but yeah lots of different things
4.14,819.92,make it possible so I'll be asking the,make it possible so I'll be asking the
4.74,822.68,same question if I happen to be any,same question if I happen to be any
6.63,824.06,father yes yes yeah please thank you so,father yes yes yeah please thank you so
5.31,827.42,much thank you for your time and that,much thank you for your time and that
4.17,830.69,was a very very encouraging conversation,was a very very encouraging conversation
4.68,832.73,so glad to have you know liked it so,so glad to have you know liked it so
4.529,834.86,much right here thank you so until we,much right here thank you so until we
6.45,837.41,catch your next you stay safe keep,catch your next you stay safe keep
6.75,839.389,working hard hey guys a quick note if,working hard hey guys a quick note if
4.83,843.86,you have a personal story that you think,you have a personal story that you think
5.19,846.139,might be helpful to the newly arriving,might be helpful to the newly arriving
4.199,848.69,immigrants in the US please contact us,immigrants in the US please contact us
4.44,851.329,we would love to feature you in our,we would love to feature you in our
5.791,852.889,podcast go to our website podcast at the,podcast go to our website podcast at the
5.461,855.769,end of the day calm and write to us by,end of the day calm and write to us by
4.529,858.68,going to the feedback section and by the,going to the feedback section and by the
4.56,861.23,way if you love this podcast you can,way if you love this podcast you can
4.341,863.209,support us with a small donation your,support us with a small donation your
5.099,865.79,help will enable us to continue,help will enable us to continue
5.2,867.55,producing more episodes the link to,producing more episodes the link to
4.851,870.889,support our podcast is in the,support our podcast is in the
2.99,872.75,description below,description below
