Duration,Start,Automated,Manual
4.56,687.77,feedback section and by the way if you,feedback section and by the way if you
4.38,690.29,love this podcast you can support us,love this podcast you can support us
4.62,692.33,with a small donation your help,with a small donation your help
5.039,694.67,will enable us to continue producing,will enable us to continue producing
7.19,696.95,more episodes the link to support our,more episodes the link to support our
4.431,699.709,podcast is in the description below,podcast is in the description below
