Duration,Start,Automated,Manual
5.94,862.03,appreciate your time so we will catch,appreciate your time so we will catch
5.46,864.64,you next week bye hey guys,you next week bye hey guys
5.13,867.97,a quick note if you have a personal,a quick note if you have a personal
4.59,870.1,story that you think might be helpful to,story that you think might be helpful to
4.17,873.1,the newly arriving immigrants in the,the newly arriving immigrants in the
4.41,874.69,u.s. please contact us we would love to,u.s. please contact us we would love to
4.23,877.27,feature you in our podcast go to our,feature you in our podcast go to our
5.37,879.1,website podcast at the end of the day,website podcast at the end of the day
5.49,881.5,comm and write to us by going to the,comm and write to us by going to the
4.53,884.47,feedback section and by the way if you,feedback section and by the way if you
4.56,886.99,love this podcast you can support us,love this podcast you can support us
5.34,889.0,with a small donation your help will,with a small donation your help will
5.4,891.55,enable us to continue producing more,enable us to continue producing more
6.5,894.34,episodes the link to support our podcast,episodes the link to support our podcast
3.89,896.95,is in the description below,is in the description below
