Duration,Start,Automated,Manual
3.51,747.16,your email address to them yes,your email address to them yes
3.66,748.36,absolutely so feel free to reach out to,absolutely so feel free to reach out to
4.11,750.67,me with any questions regarding,me with any questions regarding
5.91,752.02,international students that's sort of,international students that's sort of
7.35,754.78,you know the specialty that I'm in in,you know the specialty that I'm in in
13.13,757.93,terms of my knowledge my email is G be e,terms of my knowledge my email is G be e
13.98,762.13,and s Li em em okay yeah a and E at,and s Li em em okay yeah a and E at
7.39,771.06,gmail.com okay and feel free to put the,gmail.com okay and feel free to put the
3.84,776.11,podcast name so towards the end we would,podcast name so towards the end we would
3.27,778.45,also like to thank our Nick,also like to thank our Nick
3.54,779.95,that stands for angry Rome a new,that stands for angry Rome a new
3.9,781.72,immigrant Center for providing us the,immigrant Center for providing us the
3.69,783.49,space to record the podcast if you are a,space to record the podcast if you are a
3.84,785.62,new immigrant and if you would like to,new immigrant and if you would like to
4.17,787.18,take English language classes if you,take English language classes if you
4.56,789.46,want to take classes on how to build,want to take classes on how to build
5.01,791.35,professional skills required for the job,professional skills required for the job
4.26,794.02,market in the US well our neck is the,market in the US well our neck is the
4.08,796.36,perfect place because they provide free,perfect place because they provide free
5.09,798.28,classes to the recently arriving,classes to the recently arriving
6.75,800.44,immigrants and refugees so definitely,immigrants and refugees so definitely
7.08,803.37,keep in touch with our Nick our ESU the,keep in touch with our Nick our ESU the
5.31,807.19,english-speaking Union and then keep,english-speaking Union and then keep
5.17,810.45,keep listening to our podcast and,keep listening to our podcast and
3.74,812.5,ifinance tribe to our channel or car at,ifinance tribe to our channel or car at
7.04,815.62,the,the
8.849,816.24,so see you next week hey guys a quick,so see you next week hey guys a quick
5.01,822.66,note if you have a personal story that,note if you have a personal story that
4.741,825.089,you think might be helpful to the newly,you think might be helpful to the newly
4.2,827.67,arriving immigrants in the u.s. please,arriving immigrants in the u.s. please
4.44,829.83,contact us we would love to feature you,contact us we would love to feature you
5.49,831.87,in our podcast go to our website podcast,in our podcast go to our website podcast
5.49,834.27,at the end of the day comm and write to,at the end of the day comm and write to
5.01,837.36,us by going to the feedback section and,us by going to the feedback section and
4.53,839.76,by the way if you love this podcast you,by the way if you love this podcast you
4.8,842.37,can support us with a small donation,can support us with a small donation
5.88,844.29,your help will enable us to continue,your help will enable us to continue
4.83,847.17,producing more episodes the link to,producing more episodes the link to
4.85,850.17,support our podcast is in the,support our podcast is in the
3.02,852.0,description below,description below
